ID,_Icon1,_IconIndex1,_Place_Info1,_NPC_Info1,_Icon2,_IconIndex2,_Place_Info2,_NPC_Info2,_Talk1,_Talk2,_Purpose,_Accept_Message,_Accept_Image,_Complete_Message,_Complete_Image,_City_Name,_Mission_OnOff1,_Mission_OnOff2,_Mission_OnOff3,_Mission_OnOff4,_Quest_BaseLV,_Quest_Kind,_Quest_Guidegroup,_Quest_Npcposition,_Quest_Purpseposition,_Quest_Next,_Quest_Guidediable,_Quest_DifficultyLV,_Mission_Note1,_Npc_Talk1,_Npc_Talk2,_Npc_Talk3,_Npc_Talk4,_Npc_Talk5,_Npc_Talk6
194000003,10005001,117,亞德利卡,薇奈特,10005001,117,亞德利卡,薇奈特,我的名字是薇奈特，請多多指教! 你說現在自我介紹不重要嗎?,(為了在這種危險的地方保護薇奈特，必須清理這附近才行。),"請於""亞德利卡""消滅[飢餓克蕾舒爾]及[幻狼]並向[薇奈特]報告。",…你好。,0,順利解決了嗎?,0,17,1,1,1,1,235,劇情,0,420,420,194000004,1,235,超越等級800以上可進行,194000201,0,0,0,0,0
194000004,10005001,116,恪爾立,貝儂,10005001,117,亞德利卡,薇奈特,那個，我想不起來了。我想過要如何回答問題，但我完全不知道。但慶幸的是，不是連名字都不知道的傻瓜。\n如您所說的，我會往東走。是塔爾達洛斯對吧?,(雖然將塔爾達洛斯的方向告訴了薇奈特，但有點不安。必須依煞尼克的請求，先到恪爾立去才行。),"請去找位於""恪爾立""的 [貝儂]。",順利解決了嗎?,0,是外地人啊...。,0,17,1,1,1,1,235,劇情,0,420,419,194000005,1,235,超越等級800以上可進行,194000301,0,0,0,0,0
194000005,10005001,115,恪爾立,梅麗維爾,10005001,116,恪爾立,貝儂,女神的庇護不只一個，有兩個三個?? 你到底是什麼傢伙? 你是來自西方大陸的女神使者嗎…?,梅麗維爾應該知道玫蒂亞在哪裡。梅麗維爾在村莊中心很認真地在製作著什麼，很快就能找到。,"請去找位於""恪爾立""的[梅麗維爾]。",是外地人啊...。,0,外地人? 外地人?!,0,17,1,1,1,1,235,劇情,0,419,419,194000006,1,235,超越等級800以上可進行,194000401,0,0,0,0,0
194000006,10005001,119,恪爾立,玫蒂亞,10005001,115,恪爾立,梅麗維爾,但是外地人為什麼會在這裡呢? 這就是肉脯! 聽說外地有真的很好吃的肉脯…嗯，玫蒂亞嗎? 既然你表現出了誠意，我就告訴你玫蒂亞所在的地方。,玫蒂亞在應該最裡面的大樹前面。不過因為外地人的出現，他似乎有點不悅。,"請去找位於""恪爾立""的[玫蒂亞]。",外地人? 外地人?!,0,………….,0,17,1,1,1,1,235,劇情,0,419,419,194000007,1,235,超越等級800以上可進行,194000501,0,0,0,0,0
194000007,10005001,117,亞德利卡,薇奈特,10005001,119,恪爾立,玫蒂亞,看幻影大地的狀態變差，看來是戴伊墨斯教團的士兵們過來了啊。我們會像往常一樣，安靜地屏住呼吸，等待他們離開。\n當然知道煞尼克很照顧我，所以才派你過來，但是不能隨便接受外地人的意思，希望你能諒解。,等等，今天…啊，你有看到徘徊在幻影大地亞德利卡的人嗎? \n 現在不是楞在這裡的時候了，請馬上去確認'那位'的狀態。請先消滅周圍的怪物。\n還有如果…那位的狀態還是一樣的話，請到'龍峽谷'向阿德奇納請求協助。,"請於""亞德利卡""消滅 [旗幟羊努斯]及[疲困德雷曼]並向[薇奈特]報告。",………….,0,我還是一樣。,0,17,1,1,1,1,235,劇情,0,419,420,194000008,1,235,超越等級800以上可進行,194000601,0,0,0,0,0
194000008,10005001,118,龍峽谷,阿德奇納,10005001,117,亞德利卡,薇奈特,我沒事! 為了離開這裡，我向村子所在的地方走去，但每次我都會失去意識，好像又回到了這裡。\n我好像有點累了。 有點想睡了.... 無論如何我都會撐住的，還真奇怪呢。,(要照玫蒂亞所說的，到'龍峽谷'找阿德奇納才行。但是現在龍峽谷的狀態…。),"請於""龍峽谷""消滅[幻獸聖禱神象]並去找位於""龍峽谷"" 最深處的[阿德奇納]。",我還是一樣。,0,你是愛麗絲的使者啊。,0,17,1,1,1,1,235,劇情,0,420,420,194000009,1,235,超越等級800以上可進行,194000701,0,0,0,0,0
194000009,10005001,117,亞德利卡,薇奈特,10005001,118,龍峽谷,阿德奇納,真是不好意思，不應該辜負大家的期望的…因為被黑暗浸染的幻獸們，我只能被困在自己的領域裡…快代替我去見那位，喚起他的記憶。如果你不去做，不知道會發生什麼事…。,這是那位所需要的力量。就稱它為 '記憶的破片'吧。把這個帶去給那位。,"請去找位於""亞德利卡""的[薇奈特]。",你是愛麗絲的使者啊。,0,…………,0,17,1,1,1,1,235,劇情,0,420,420,194000010,1,235,超越等級800以上可進行,194000801,0,0,0,0,0
194000010,10005001,117,亞德利卡,薇奈特,10005001,117,亞德利卡,薇奈特,謝謝你，多虧你，我才能找回記憶。我不想這樣跟你見面的…。\n我不能消耗太多力氣，只能以人的模樣走來走去。在我醒來時，邪惡的黑暗降臨，在尋找阿德奇納的過程中…,要說我是軟弱的神也沒關係，這一切都是我的錯…。\n在我失去記憶的這段時間，幻影大地被黑暗的存在所蠶食，阿德奇納也被囚禁了。\n能去我沉睡後醒來的地方─'拉法爾'確認一下嗎? 說不定那裡有讓我變成這樣的存在。,"請於""神之樹拉法爾""消滅[安魂者]獲得<被遺忘的世界結晶>。並向位於""亞德利卡""的[薇奈特]報告。",…………,0,謝謝。,0,17,1,1,1,1,235,劇情,0,420,420,194000011,1,235,超越等級800以上可進行,194000901,194001001,194001101,194001201,194001301,0
194000011,10005001,119,恪爾立,玫蒂亞,10005001,117,亞德利卡,薇奈特,託你的福，在拉法爾的黑暗退去了。現在幻影大地上感受不到黑暗了。\n去找玫蒂亞談談吧。 那麼他們自然會知道發生了什麼事。,還有關於那個老人，目前無話可說。到時候你會明白的....,"請去""恪爾立""找[玫蒂亞]。",謝謝。,0,知道了。,0,17,1,1,1,1,235,劇情,0,420,419,194000012,1,235,超越等級800以上可進行,194001401,0,0,0,0,0
194000012,10005001,107,地下都市塔爾達洛斯,煞尼克,10005001,119,恪爾立,玫蒂亞,女神與幻影大地的氣息一起回來了啊。雖然蓋亞 沒有親自過來，但他告訴我發生了什麼事。,凡事都有光和影，不是善與惡…也適用於你所做的事情上，請一定要記住。現在請回到派你來這裡的煞尼克那邊去吧。,"請去找位於""地下都市塔爾達洛斯""的[煞尼克]。",知道了。,0,辛苦了~,0,17,1,1,1,1,235,劇情,0,419,402,0,1,235,超越等級800以上可進行,194001501,194001601,0,0,0,0
201000001,10005000,208,聯合公會,愛因斯特,10005000,208,聯合公會,愛因斯特,(是不曾呼叫的愛因斯特，有什麼事呢? 要去一趟才行。 有些不想去想的事，好像要忙碌一點才能忘記。),………….,"請去找位於""聯合公會""的[愛因斯特]。",,0,好久不見了。,0,17,1,1,1,1,235,劇情,0,184,184,201000002,1,235,超越等級1000以上可進行,0,0,0,0,0,0
201000002,10005000,207,無限迴廊,傑伊特,10005000,208,聯合公會,愛因斯特,這段時間你發生了很多事啊。但希望你能保持從容。傑芮尼斯學院送來的學院祭邀請函已經到了這裡，確認後發現收件人是你。,學院可能認為你是個特別的人物。傑芮尼斯學院祭不會隨便發邀請函給任何人。無限迴廊的傑伊特出身於傑芮尼斯，他會跟你說更多的。,"請去找位於""無限迴廊""的[傑伊特]。",好久不見了。,0,這段時間過得好嗎?,0,17,1,1,1,1,235,劇情,0,184,184,201000003,1,235,超越等級1000以上可進行,201000101,0,0,0,0,0
201000003,10005001,123,傑芮尼斯山丘,賽伊娜,10005000,207,無限迴廊,傑伊特,你受到學院祭的邀請，不知道該往哪裡去嗎? 傑芮尼斯魔法學院位於艾爾亞諾勒平原西部往西北方向一直前進的傑芮尼斯山丘上。但是，現在通往那邊的道路因為狐狸巡邏兵的威脅而堵住了。,但是為了可以安全前行，在天空海內建了一個傳送門。透過那裡到傑芮尼斯山丘去就行了。學生們會親切地帶領你的，祝你玩得愉快。,"請去找位於""傑芮尼斯山丘""的[賽伊娜]。",這段時間過得好嗎?,0,你好。,0,17,1,1,1,1,235,劇情,0,184,433,201000004,1,235,超越等級1000以上可進行,201000201,0,0,0,0,0
201000004,10005000,217,傑芮尼斯山丘,萊莉,10005001,123,傑芮尼斯山丘,賽伊娜,歡迎來到魔法學院傑芮尼斯學院祭 '達芙妮'! 噢，但是怎麼辦呢? 這次學院祭發生了一點事，你沒辦法參加了。,你是拯救猶忒王國的英雄，對吧? 你能幫我一個忙嗎? 你在來傑芮尼斯山丘的時候一定看到了很多奇怪的東西，可以阻止他們到天空海外面去嗎?,"請於""傑芮尼斯山丘""消滅[音樂學系1年級生]和[自傲的知識精靈]，並向[萊莉]報告。",你好。,0,過得好嗎?,0,17,1,1,1,1,235,劇情,0,433,433,201000005,1,235,超越等級1000以上可進行,201000301,0,0,0,0,0
201000005,10005001,123,傑芮尼斯山丘,賽伊娜,10005000,217,傑芮尼斯山丘,萊莉,紅色蝴蝶結的長馬尾辮女同學這樣拜託你嗎? 賽伊娜大人，不，賽伊娜說要從學生會室帶過來什麼東西，所以暫時進去了。,不好意思，可以拜託你做同樣的事情嗎？ 可以不要讓這些奇怪的東西到天空海外面去嗎? 你回來後，我會如實告訴你這裡的情況。,"請於""傑芮尼斯山丘""消滅[音樂學系2年級生]和[1年級魔法掃帚]，並向[賽伊娜]報告。",過得好嗎?,0,謝謝。這是怎麼一回事呢…,0,17,1,1,1,1,235,劇情,0,433,433,201000006,1,235,超越等級1000以上可進行,201000401,0,0,0,0,0
201000006,10005001,123,傑芮尼斯山丘,賽伊娜,10005001,123,傑芮尼斯山丘,賽伊娜,普雷伊奧斯大陸上有一個跟傑芮尼斯魔法學院一起獲得帝國內獨立權限的，名為'賢者之塔'的地方。由於彼此關係親近，我們學院祭在他們魔法研討會期間會常常開玩笑。\n但是，這次不一樣。以為是賢者之塔那邊送來的惡搞禮物箱，沒想到卻散發出了奇怪的氣息。比起玩笑更像是詛咒…\n魔法道具隨心所欲行動，部分學生被洗腦，正在破壞學校。,而且詛咒的力量集中在具有強大魔力的理事長和校長身上。位於魔法修練館的澤費羅斯老師讓孩子們逃生後，就被關了起來。\n請分散與物品融合，變成另一種面貌的澤費羅斯老師的力量。以冒險家的力量打倒的話，魔力就會散去。那麼老師和其他學生，還有一般物品都能恢復原樣。,"請消滅位於""魔法修練館""的[澤費羅斯]並向位於""傑芮尼斯山丘""的[賽伊娜]報告。",謝謝。這是怎麼一回事呢…,0,謝謝。老師沒事。,0,17,1,1,1,1,235,劇情,0,433,433,201000007,1,235,超越等級1000以上可進行,201000501,0,0,0,0,0
201000007,10005000,207,無限迴廊,傑伊特,10005001,123,傑芮尼斯山丘,賽伊娜,冒險家，謝謝你救了澤費羅斯老師。據萊莉前輩所說，現在學校中感受到的是魔界的氣息。到底為什麼學校裡會…,我們會盡量讓學校內的魔界氣息不要向外流失，可以請你到無限迴廊的傑伊特那邊，將製作帝國之門時所使用的寶石借來嗎?,"請去找位於""無限迴廊""的[傑伊特]。",謝謝。老師沒事。,0,冒險家，要怎麼參觀學院祭…,0,17,1,1,1,1,235,劇情,0,433,184,201000008,1,235,超越等級1000以上可進行,201000601,0,0,0,0,0
201000008,10005000,217,傑芮尼斯山丘,萊莉,10005000,207,無限迴廊,傑伊特,最近整理倉庫，發現有裂痕，所以就委託了亞奇城進行修理，時機正好呢。,可以將這個帶給萊莉嗎?,"請去找位於""傑芮尼斯山丘""的[萊莉]。",冒險家，要怎麼參觀學院祭…,0,這是那個附屬…,0,17,1,1,1,1,235,劇情,0,184,433,201000009,1,235,超越等級1000以上可進行,201000701,0,0,0,0,0
201000009,10005001,123,傑芮尼斯山丘,賽伊娜,10005000,217,傑芮尼斯山丘,萊莉,現在克蘿莉絲老師的力量和windy seed的力量相遇，產生共鳴。說不定是老師的魔力使得windy seed暴走…。,冒險家，再拜託你一次。現在我們需要冒險家的力量。我和賽伊娜會除去魔界氣息，克蘿莉絲就拜託你了。能讓那位恢復原樣的方法只有利用冒險家的力量打倒了。,"請於""魔法學院本館""消滅[克蘿莉絲]，並向位於""傑芮尼斯山丘""的[賽伊娜]報告。",這是那個附屬…,0,冒險家，沒事吧? 這段時間我一直在找你。,0,17,1,1,1,1,235,劇情,0,433,433,201000010,1,235,超越等級1000以上可進行,201000801,0,0,0,0,0
201000010,10005000,207,無限迴廊,傑伊特,10005001,123,傑芮尼斯山丘,賽伊娜,克蘿莉絲老師沒事。和老師結合在一起的windy seed也安全地回到了原位。雖然回復到原來的樣子還不錯，但我覺得還是要確認一下身體狀況，所以和澤費羅斯老師一起去了帝國的首都。冒險家沒事吧?,太好了。之後我們會再寄送學院祭邀請函，可以再過來一次嗎? \n謝謝你。你要去找傑伊特的話，請告訴他我們沒事。,"請去找位於""無限迴廊""的[傑伊特]。",冒險家，沒事吧? 這段時間我一直在找你。,0,感謝你救了學校。,0,17,1,1,1,1,235,劇情,0,433,184,201000011,1,235,超越等級1000以上可進行,201000901,0,0,0,0,0
201000011,10005000,210,公會旅館,雷娜,10005000,207,無限迴廊,傑伊特,雖然我大概知道學校裡有古代的遺物，但能有這樣的能力還是很驚訝。還有，我很擔心，魔界的氣息出現在有遺物的學校裡，這讓人想起了從前的事，再次向你表示感謝。,啊，有件事我忘了說。雷娜夏伊蓮在銀光盾牌酒店裡等冒險家。聽說他給冒險家帶來了女帝陛下的敕書。,"請去找位於""銀光盾牌酒店""的[雷娜夏伊蓮]。",感謝你救了學校。,0,這段時間就好好休息吧。,0,17,1,1,1,1,235,劇情,0,184,184,0,1,235,超越等級1000以上可進行,201001001,201001101,0,0,0,0
202000001,10005000,210,公會旅館,雷娜,10005000,210,公會旅館,雷娜,(今天就是雷娜夏伊蓮要我等待的日子，去看看吧?),,"請去找位於""銀光盾牌酒店""的[雷娜夏伊蓮]。",,0,來得好，那我要開始說了。,0,17,1,1,1,1,235,劇情,0,184,184,202000002,1,235,超越等級1300以上可進行,0,0,0,0,0,0
202000002,10005001,124,艾司尼爾,戴娜,10005000,210,公會旅館,雷娜,傳達陛下的敕書。封印在你觸碰的瞬間自然就會消失了。陛下要你到墨羅斯地區去看看。要怎麼做? 雖然選擇權在你手上…。,有意願的話去找戴娜總長談談吧。總長在都市裡面。,"請去找位於""艾司尼爾""的[戴娜]。",來得好，那我要開始說了。,0,你就是那個人啊。,0,17,1,1,1,1,235,劇情,0,184,184,202000003,1,235,超越等級1300以上可進行,202000101,0,0,0,0,0
202000003,10005001,128,艾司尼爾,拉格雷特,10005001,124,艾司尼爾,戴娜,雖然獲得了陛下的許可，也獲得了進入艾司尼爾的許可…。我對未曾經歷過的對象會先抱持著懷疑，不然就無法得知了。,讓我們看看你的實力吧。 因為沒有比展現實力更確實的了。有事要你跟拉格雷特一起做。,"請於""戰士們的休息地""消滅[雷頓]獲得<扭曲者的記錄>。並向位於""艾司尼爾""的[拉格雷特]報告。",你就是那個人啊。,0,已經確認了你的實力，去找戴娜總長吧。,0,17,1,1,1,1,235,劇情,0,184,184,202000004,1,235,超越等級1300以上可進行,202000201,0,0,0,0,0
202000004,10005001,124,艾司尼爾,戴娜,10005001,128,艾司尼爾,拉格雷特,女神所選擇的人，果然不一樣。實力很優秀，去找總長他會看著辦的。,好奇的事很多呢。簡單來說就是扭曲了。,"請去找位於""艾司尼爾""的[戴娜]。",已經確認了你的實力，去找戴娜總長吧。,0,抱歉，看得出來我是在測試你嗎?,0,17,1,1,1,1,235,劇情,0,184,184,202000005,1,235,超越等級1300以上可進行,202000301,0,0,0,0,0
202000005,10005001,126,墨羅斯,奧菕,10005001,124,艾司尼爾,戴娜,我們? 只是稍微有點扭曲而已…。現在你有該去的地方。不曉得你知不知道，是聯軍所在的東方大陸墨羅斯地區。,去那裡幫助那些正在努力與墨斯王國的敵人們戰鬥的人。幫忙的話就會知道了，要做些什麼事。適當地處理一下，向那邊的聖騎士創世主報告。,"請於""墨羅斯""消滅[墨斯王國騎士]和[紅色希爾帝斯維尼]。並向位於""墨羅斯""的[奧菕]報告。",抱歉，看得出來我是在測試你嗎?,0,我聽說了，女神的劊子手…。,0,17,1,1,1,1,235,劇情,0,184,442,202000006,1,235,超越等級1300以上可進行,202000401,0,0,0,0,0
202000006,10005001,126,墨羅斯,奧菕,10005001,126,墨羅斯,奧菕,啊，你就是…，我聽陛下說了。我是奧菕，如你所見，我是創世主。,雖然自己來也行，但覺得會花很久的時間，所以想拜託你。請給我能跟女神的劊子手一起戰鬥的機會，我會努力的。,"請於""墨羅斯""消滅[墨斯王國法師]、[燕尾服薛丁格]。並向位於""墨羅斯""的[奧菕]報告。",我聽說了，女神的劊子手…。,0,去找普拉蒂娜吧?,0,17,1,1,1,1,235,劇情,0,442,442,202000007,1,235,超越等級1300以上可進行,202000501,0,0,0,0,0
202000007,10004001,37,墨羅斯,普拉蒂娜,10005001,126,墨羅斯,奧菕,這段時間， '聖域'關注了包含普雷伊奧斯在內的大陸地區發生的事。結果，為了討伐這所有事情的元兇，成立了聯軍。,現在要到普拉蒂娜那邊去了。他一定在等著冒險家。 那麼我就繼續努力了。,"請去找在""墨羅斯""的""魔力防空洞"" 前方的 [普拉蒂娜]。",去找普拉蒂娜吧?,0,這段時間沒什麼事吧，冒險家。,0,17,1,1,1,1,235,劇情,0,442,442,202000008,1,235,超越等級1300以上可進行,202000601,0,0,0,0,0
202000008,10004001,37,墨羅斯,普拉蒂娜,10004001,37,墨羅斯,普拉蒂娜,聯軍佔領了墨斯王國的據點後，幾個村莊和勢力都投降了。現在墨斯王國的的末路已經不遠了。,也許陛下叫你過來是有原因的。冒險家，請去處置在魔力防空洞裡的諾克斯王子。,"請於""魔力防空洞""消滅 [諾克斯王子]，並向位於'墨羅斯'的[普拉蒂娜]報告。",這段時間沒什麼事吧，冒險家。,0,辛苦了。但要做的事很多。,0,17,1,1,1,1,235,劇情,0,442,442,202000009,1,235,超越等級 1300 以上可進行,202000701,202010701,202020701,0,0,0
202000009,10005001,66,墨羅斯,秦,10004001,37,墨羅斯,普拉蒂娜,現在冒險家必須到奧涅伊洛森林去才行。奧涅伊洛森林在墨羅斯地區的最裡面。,到那邊，會有冒險家認識的人在等著你的。請千萬要小心。\n…………。,"請去位於""墨羅斯""的[夢境奧涅伊洛] 前方找[秦]。",辛苦了。但要做的事很多。,0,這段時間處理了很多事啊。,0,17,1,1,1,1,235,劇情,0,442,442,202000010,1,235,超越等級1500以上可進行,202000801,0,0,0,0,0
202000010,10005001,66,墨羅斯,秦,10005001,66,墨羅斯,秦,這片森林的名字叫奧涅伊洛。這是以墨斯王國不吉利為由，而被限制靠近的森林。因為有守護者的存在，一旦存有惡心，就會被驅逐或訓斥…。,那種事現在沒關係了吧。現在你在這片森林裡有事必須去做。凡恩和瑪拉，他們進去了。 希望你能去做只有你能做到的事。,"請於'夢境奧涅伊洛'消滅[貝格爾米爾]，獲得 <貝格爾米爾的心臟破片>。並向位於""墨羅斯""的[秦]報告。",這段時間處理了很多事啊。,0,振作點!! 沒事吧?,0,17,1,1,1,1,235,劇情,0,442,442,202000011,1,235,超越等級1500以上可進行,202000901,202010901,202020901,202030901,202040901,202050901
202000011,10005001,124,艾司尼爾,戴娜,10005001,66,墨羅斯,秦,墨羅斯的事都結束了，剩下的聯軍會看著辦…。,辛苦了。詳情不用跟我說。現在回去吧，也把情況跟把你送到這裡的普雷伊奧斯那邊的人說吧。,"請與位於""墨羅斯"" [夢境奧涅伊洛] 前方的[秦]對話後，去找位於""艾司尼爾""的[戴娜]。",振作點!! 沒事吧?,0,這個世界又欠了你人情呢。,0,17,1,1,1,1,235,劇情,0,442,184,0,1,235,超越等級1500以上可進行,202001001,202001101,0,0,0,0
202002101,10005001,128,墨羅斯內部,拉格雷特,10005001,128,墨羅斯內部,拉格雷特,新人，振作點，這樣呆愣著是什麼也做不了的。,請消滅怪物後來找我吧。,"請於""墨羅斯內部 1""消滅[旋風持盾戰士]，並向 [拉格雷特]報告任務。",,0,做得好，新人。,0,22,1,1,1,1,1,新手教學,0,442,442,202002102,1,1,,0,0,0,0,0,0
202002102,10005001,129,墨羅斯內部,杰利克,10005001,128,墨羅斯內部,拉格雷特,看起來比想像中愉快呢，我也是這樣的。我煩惱了很久，能用這股力量做什麼呢。,這種事以後再說吧。請去找杰利克，路上也會有怪物要小心。,"請於""墨羅斯內部 2'消滅[飛舞劍刃巴夫洛夫]和[創世主巴夫洛夫]，並向[杰利克]報告任務。",做得好，新人。,0,心情如何? 做的好嗎?,0,22,1,1,1,1,1,新手教學,0,442,442,202002103,1,1,,0,0,0,0,0,0
202002103,10005001,124,墨羅斯內部,戴娜,10005001,129,墨羅斯內部,杰利克,剛開始大家都很開心。喔…，總長來了嗎? 那直接去報告一下這裡的狀況如何?,總長一定也在等你。,"消滅位於""墨羅斯內部 3""的[旋風持盾戰士]和[飛舞劍刃巴夫洛夫]、[創世主巴夫洛夫]。並向在裡面的[戴娜]報告。",心情如何? 做的好嗎?,0,比想像中還厲害。,0,22,1,1,1,1,1,新手教學,0,442,442,202002104,1,1,,0,0,0,0,0,0
202002104,10005001,124,墨羅斯內部,戴娜,10005001,124,墨羅斯內部,戴娜,我們跟別人不一樣，你應該也很清楚…，你和我們的能力是別人所害怕的。,所以要小心一點…等等，現在要去哪裡啊?,"聽見奇怪的聲音，進到""奧涅伊洛內部""，在""奧涅伊洛內部 1""消滅[紅色希爾帝斯維尼]和[燕尾服薛丁格]。並在見到奇怪的存在後到外面向[戴娜]報告。",比想像中還厲害。,0,…………。,0,22,1,1,1,1,1,新手教學,0,442,442,202002105,1,1,,0,0,0,0,0,0
202002105,10005000,2,貝羅斯村莊,亞瑟絲,10005001,124,墨羅斯內部,戴娜,某個世界選擇了你作為救援者，但你的黑暗不僅很淺還很弱。所以很不安，不知道你能不能做到…。,要試試看?好吧…。抱歉，這應該就是命運吧。,"請到達""貝羅斯""向[亞瑟絲]報告。",…………。,0,呼呼，歡迎來到貝羅斯。,0,22,1,1,1,1,1,新手教學,0,442,2,0,1,1,,0,0,0,0,0,0
154001032,0,0,,,0,0,,,你完美地通過了所有試驗，我就按照約定給你石塔的鑰匙。\n拿著這個觸碰石塔，就能獲得愛麗絲的安排。,請移動至貝爾法圖書館，透過在[魔法書閱覽室]內部的<愛麗絲的石塔>獲得愛麗絲的安排。,"請移動至""貝爾法圖書館""，透過位於 ""魔法書閱覽室內部""的愛麗絲石塔獲得<愛麗絲的安排>。",,0,,0,0,1,1,1,1,1,,0,0,0,0,1,0,,0,0,0,0,0,0
154001130,0,0,,,0,0,,,確認結束了。 給你鑰匙，請去獲得愛麗絲的安排。,辛苦了。\n請移動至[被遺忘的花園]確認<愛麗絲的第二座石塔>。,"請移動至""被遺忘的花園""獲得<愛麗絲的第二個安排>。",,0,,0,0,1,1,1,1,1,,0,0,0,0,1,0,,0,0,0,0,0,0
154001229,0,0,,,0,0,,,既然答應了我所有的請求，我就按照約定給你能解除封印的鑰匙吧。\n冒險家有資格獲得石塔的安排。,快到[火山地帶]解除石塔的封印獲得安排吧。,"請於""火山地帶""再次確認<愛麗絲的第三座石塔>。",,0,,0,0,1,1,1,1,1,,0,0,0,0,1,0,,0,0,0,0,0,0
154001329,0,0,,,0,0,,,你做得非常好，給你鑰匙。,請到[伊米勒研究所]解除石塔的封印獲得安排。\n真是辛苦你了。,"請移動至""伊米勒研究所""再次確認<愛麗絲的第四座石塔>。",,0,,0,0,1,1,1,1,1,,0,0,0,0,1,0,,0,0,0,0,0,0
154001436,0,0,,,0,0,,,給你鑰匙。\n冒險家有資格獲得鑰匙。\n謝謝你答應我無理的請求。,快移動至世界樹的幻影確認<愛麗絲的第五座石塔>吧。,"請移動至""世界樹""、""世界樹的幻影""再次確認<愛麗絲的第五座石塔>。",,0,,0,0,1,1,1,1,1,,0,0,0,0,1,0,,0,0,0,0,0,0
154001525,0,0,,,0,0,,,真是完美啊。\n讓人大吃一驚。其實，在等待的過程中，我一直擔心我是否做了過分的請求…。\n做為謝禮，給你鑰匙。,希望你能到<愛麗絲的第六座石塔>的所在地獲得想要的東西。,"請完成""青空城2層""確認<愛麗絲的第六座石塔>。",,0,,0,0,1,1,1,1,1,,0,0,0,0,1,0,,0,0,0,0,0,0
154001636,0,0,,,0,0,,,他居然還記得我的名字… 哈哈，這真是太榮幸了。\n我不知道有沒有說過… 那位可不是普通人。\n他建立了吉恩蒂亞帝國，是到目前為止一直統治著帝國的吉恩蒂亞 帝國的 '皇帝'。\n與位於吉恩蒂亞大陸東方的艾利亞斯王國維持著非常良好的關係。,總之… 既然你為了我做了這麼困難的事，我就按照約定給你愛麗絲託付的鑰匙吧。\n請將鑰匙使用在正確的地方，謝謝。,"請完成""未知的倉庫地下20層""，再次確認<愛麗絲的第七座石塔>。",,0,,0,0,1,1,1,1,1,,0,0,0,0,1,0,,0,0,0,0,0,0
164001116,0,0,,,0,0,,,(現在是要解除第八座石塔的封印，獲得裡面安排的時候了。再次移動至石塔的所在地[青空城]吧。),,,,0,,0,0,1,1,1,1,1,,0,0,0,0,1,0,,0,0,0,0,0,0
